{
  "$schema": "./couches.schema.json",
  "version": "0.1.0",
  "metadata": {
    "last_updated": "2026-05-04",
    "license": "CC0-1.0",
    "non_affiliation": "L'Anthropie has no link with Anthropic PBC, OpenAI, or any commercial AI actor. See NOT_AN_AI_LAB.md and NAMING.md."
  },
  "couches": [
    {
      "n": 1,
      "slug": "couche-01-matrice",
      "nom": "LA MATRICE",
      "age": "0-3",
      "coeur": "Présence des aînés (RPU), 7 strates affectives (Pikler-Lóczy, allomaternage)",
      "file": "anthropie_couche_01_matrice.md",
      "article_crc": null,
      "maturite": "robuste",
      "claims_cles": [
        { "claim_id": "C01-A1", "claim": "L'attachement sécure 0-3 ans est cross-culturellement protecteur, dans des formes culturellement variables", "evidence_level": "A", "source_type": "meta-analyse", "primary_source": "Heidi Keller, Univ. Osnabrück 2018-2024 ; van IJzendoorn meta-analyses Leiden" },
        { "claim_id": "C01-A2", "claim": "L'allomaternage (cooperative breeding) est la norme historique de l'humanité", "evidence_level": "A", "source_type": "framework-eprouve", "primary_source": "Sarah Hrdy, Mothers and Others, Harvard 2009" },
        { "claim_id": "C01-A3", "claim": "Le ratio adulte/enfant 1:3 ou 1:4 est nécessaire pour attachement sécure 0-2 ans", "evidence_level": "A", "source_type": "longitudinal", "primary_source": "NICHD Study of Early Child Care USA ; OECD Starting Strong V 2017" },
        { "claim_id": "C01-D1", "claim": "Le RPU (Revenu Présence Universel) des aînés peut résoudre simultanément solitude des aînés, ratio adulte-enfant insuffisant et transmission inter-générationnelle", "evidence_level": "D", "source_type": "invention-propre", "primary_source": "Anthropie — couche 1" }
      ],
      "depends_on": [],
      "feeds_into": [2, 11],
      "safety_flags": ["protection-mineurs", "donnees-personnelles"],
      "sovereignty_flags": [],
      "falsifiers": [
        "Méta-analyse 2026-2030 démontrant absence d'effet du ratio adulte/enfant 1:4 sur attachement sécure",
        "Étude RPU pilote produisant zéro effet ou effet inverse sur la solitude des aînés ou la qualité d'attachement"
      ],
      "open_grievances": []
    },
    {
      "n": 2,
      "slug": "couche-02-sanctuaire",
      "nom": "LE SANCTUAIRE",
      "age": "3-7",
      "coeur": "7 disciplines de la posture adulte, droit à la curiosité préservée",
      "file": "anthropie_couche_02_sanctuaire.md",
      "article_crc": "31bis",
      "maturite": "sensible",
      "claims_cles": [
        { "claim_id": "C02-B1", "claim": "Reggio Emilia 0-6 ans produit développement créatif documenté", "evidence_level": "B", "source_type": "framework-eprouve", "primary_source": "Reggio Children consortium 1963-2024 ; Schneider 2024" },
        { "claim_id": "C02-D1", "claim": "Un opt-out scolaire 3-7 avec statut civil de Compagnons-Maîtres et Témoins Garants peut tenir juridiquement et socialement dans les États-pilotes", "evidence_level": "D", "source_type": "invention-propre", "primary_source": "Anthropie — couche 2 + article 31bis" }
      ],
      "depends_on": [1],
      "feeds_into": [3, 4],
      "safety_flags": ["protection-mineurs", "anti-secte"],
      "sovereignty_flags": ["maori"],
      "falsifiers": [
        "Précédent juridique national d'opt-out scolaire reconnaissant effet pervers documenté (mineurs lésés)"
      ],
      "open_grievances": ["G-002"]
    },
    {
      "n": 3,
      "slug": "couche-03-atelier",
      "nom": "L'ATELIER",
      "age": "5-12",
      "coeur": "Constructionnisme Papert + Pont des Certifications (Open Badges 3.0)",
      "file": "anthropie_couche_03_atelier.md",
      "article_crc": "31ter",
      "maturite": "robuste",
      "claims_cles": [
        { "claim_id": "C03-A1", "claim": "Le constructionnisme produit apprentissage durable supérieur à la pédagogie transmissive", "evidence_level": "A", "source_type": "framework-eprouve", "primary_source": "Seymour Papert MIT 1980-2000 ; multiples études STEM 2000-2024" },
        { "claim_id": "C03-B1", "claim": "Open Badges 3.0 + W3C VC sont infalsifiables cryptographiquement", "evidence_level": "B", "source_type": "framework-eprouve", "primary_source": "W3C VC Recommandation 2022 ; ELM EU 2023" }
      ],
      "depends_on": [2],
      "feeds_into": [4, 5],
      "safety_flags": ["protection-mineurs", "donnees-personnelles"],
      "sovereignty_flags": [],
      "falsifiers": [
        "Étude longitudinale démontrant absence d'effet du constructionnisme Papert sur réussite académique post-Atelier"
      ],
      "open_grievances": []
    },
    {
      "n": 4,
      "slug": "couche-04-parole",
      "nom": "LA PAROLE",
      "age": "7-15",
      "coeur": "Cercles de Voix + Discipline de Prédiction-Avant-Vocal anti-LLM-flattening",
      "file": "anthropie_couche_04_parole.md",
      "article_crc": "31quater",
      "maturite": "robuste",
      "claims_cles": [
        { "claim_id": "C04-A1", "claim": "L'art forum boalien produit délibération inclusive efficace", "evidence_level": "A", "source_type": "framework-eprouve", "primary_source": "Augusto Boal 1974 ; Catherine Wallis Lüneberg 2025" },
        { "claim_id": "C04-D1", "claim": "La Discipline de Prédiction-Avant-Vocal en 4 temps atténue l'aplatissement LLM-induit du langage adolescent", "evidence_level": "D", "source_type": "invention-propre", "primary_source": "Anthropie — couche 4 (innovation propre)" }
      ],
      "depends_on": [3],
      "feeds_into": [5, 6, 7],
      "safety_flags": ["protection-mineurs", "ai-non-substitution"],
      "sovereignty_flags": [],
      "falsifiers": [
        "Étude qualitative 100-500 ados sur 2 ans démontrant que la PAV ne réduit pas l'aplatissement langagier mesuré"
      ],
      "open_grievances": ["G-003"]
    },
    {
      "n": 5,
      "slug": "couche-05-ville",
      "nom": "LA VILLE",
      "age": "10-18",
      "coeur": "RCI Illich + Big Picture Learning + dual apprenticeship suisse",
      "file": "anthropie_couche_05_ville.md",
      "article_crc": "31quinquies",
      "maturite": "sensible",
      "claims_cles": [
        { "claim_id": "C05-B1", "claim": "Big Picture Learning produit engagement scolaire élevé sur cohortes 14-18 ans", "evidence_level": "B", "source_type": "framework-eprouve", "primary_source": "LTI Boston Univ. ; OECD 2018-2023" },
        { "claim_id": "C05-C1", "claim": "L'articulation RCI Illich + dual apprenticeship suisse + reconnaissance professionnelle 31quinquies tient à scale", "evidence_level": "C", "source_type": "inference", "primary_source": "Anthropie — couche 5 (extrapolation)" }
      ],
      "depends_on": [3, 4],
      "feeds_into": [6, 7, 8],
      "safety_flags": ["protection-mineurs"],
      "sovereignty_flags": [],
      "falsifiers": [
        "Précédent juridique 31quinquies dans un État-pilote produisant disparition des apprentissages exploratoires (effet inverse)"
      ],
      "open_grievances": []
    },
    {
      "n": 6,
      "slug": "couche-06-regard",
      "nom": "LE REGARD",
      "age": "10-18",
      "coeur": "CVO Freire + Critique deepfakes + Diaspora Visuelle",
      "file": "anthropie_couche_06_regard.md",
      "article_crc": "31sexies",
      "maturite": "sensible",
      "claims_cles": [
        { "claim_id": "C06-A1", "claim": "Crisis of knowing face aux deepfakes documentée par UNESCO", "evidence_level": "A", "source_type": "framework-eprouve", "primary_source": "UNESCO Recommandation IA 2021-2024" },
        { "claim_id": "C06-D1", "claim": "Une CVO (Critique Visuelle Organisée) freirienne adolescente peut tenir face à régimes autoritaires via diaspora visuelle", "evidence_level": "D", "source_type": "invention-propre", "primary_source": "Anthropie — couche 6" }
      ],
      "depends_on": [4],
      "feeds_into": [7],
      "safety_flags": ["protection-mineurs", "ai-non-substitution"],
      "sovereignty_flags": [],
      "falsifiers": [
        "Documentation que la diaspora visuelle est facilement neutralisée par filtrage Internet régime"
      ],
      "open_grievances": []
    },
    {
      "n": 7,
      "slug": "couche-07-seuils",
      "nom": "LES SEUILS",
      "age": "12-22",
      "coeur": "12 Rites Articulés + Liminalité Protégée juridique",
      "file": "anthropie_couche_07_seuils.md",
      "article_crc": "31septies",
      "maturite": "robuste",
      "claims_cles": [
        { "claim_id": "C07-B1", "claim": "Les rites de passage articulés produisent effets documentés sur la transition adolescente", "evidence_level": "B", "source_type": "framework-eprouve", "primary_source": "Victor Turner liminality 1969 ; corpus anthropologique" },
        { "claim_id": "C07-D1", "claim": "Une Liminalité Protégée juridique opt-in peut s'inscrire sans pénalité scolaire/professionnelle", "evidence_level": "D", "source_type": "invention-propre", "primary_source": "Anthropie — couche 7 + article 31septies" }
      ],
      "depends_on": [4, 5, 6],
      "feeds_into": [8, 11, 12],
      "safety_flags": ["protection-mineurs", "co-design-autochtone"],
      "sovereignty_flags": ["maori", "anishinaabe", "aboriginal", "lakota", "yoruba"],
      "falsifiers": [
        "Refus collectif documenté des communautés Maori/Anishinaabe/Aboriginal/Saami/Yoruba/Lakota à l'usage de leurs traditions par l'édifice"
      ],
      "open_grievances": ["G-001"]
    },
    {
      "n": 8,
      "slug": "couche-08-mycologie",
      "nom": "LA MYCOLOGIE",
      "age": "15-25",
      "coeur": "Cellules Mycéliales 4-7 personnes 5-10 ans (refondation post-BCI)",
      "file": "anthropie_couche_08_mycologie.md",
      "article_crc": "31octies",
      "maturite": "sensible",
      "claims_cles": [
        { "claim_id": "C08-C1", "claim": "Une cellule mycéliale 4-7 personnes engagée 5-10 ans produit observation longue qualitative", "evidence_level": "C", "source_type": "inference", "primary_source": "Anthropie — couche 8 (extrapolation Reggio adulte + AA groupes longs)" },